### ISSUE TITLE
Clementine contacts ghs.google.com

### ISSUE THREAD

**Issue by acrobat1** [clementine-player/Clementine#4993]
Using Clementine 1.2 I can see that it is exchanging data with Google even if all google-related services are turned off in preferences and I have no account on google drive:

16231 1601.437517 192.168.1.100 -> 8.8.8.8DNS 86 Standard query 0x740d  A data.clementine-player.org
16232 1601.437543 192.168.1.100 -> 8.8.8.8DNS 86 Standard query 0x8f11  AAAA data.clementine-player.org
16233 1601.461586 8.8.8.8-> 192.168.1.100 DNS 150 Standard query response 0x740d  CNAME ghs.google.com CNAME ghs.l.google.com A 173.194.67.121
16234 1602.294172 8.8.8.8-> 192.168.1.100 DNS 162 Standard query response 0x8f11  CNAME ghs.google.com CNAME ghs.l.google.com AAAA 2a00:1450:400c:c0b::79
16235 1602.294667 192.168.1.100 -> ghs.l.google.com TCP 74 37308→80 [SYN] Seq=0 Win=29200 Len=0 MSS=1460 SACK_PERM=1 TSval=2452212 TSecr=0 WS=128
16236 1602.336547 ghs.l.google.com -> 192.168.1.100 TCP 74 80→37308 [SYN, ACK] Seq=0 Ack=1 Win=42540 Len=0 MSS=1430 SACK_PERM=1 TSval=1725506592 TSecr=2452212 WS=128
16237 1602.336611 192.168.1.100 -> ghs.l.google.com TCP 66 37308→80 [ACK] Seq=1 Ack=1 Win=29312 Len=0 TSval=2452222 TSecr=1725506592
16238 1602.336801 192.168.1.100 -> ghs.l.google.com HTTP 230 GET /geolocate HTTP/1.1 
16239 1602.380290 ghs.l.google.com -> 192.168.1.100 TCP 66 80→37308 [ACK] Seq=1 Ack=165 Win=43648 Len=0 TSval=1725506636 TSecr=2452222
16240 1602.492824 ghs.l.google.com -> 192.168.1.100 HTTP 355 HTTP/1.1 200 OK  (application/json)
16241 1602.492878 192.168.1.100 -> ghs.l.google.com TCP 66 37308→80 [ACK] Seq=165 Ack=290 Win=30336 Len=0 TSval=2452261 TSecr=1725506748
16242 1602.493735 192.168.1.100 -> ghs.l.google.com TCP 66 37308→80 [FIN, ACK] Seq=165 Ack=290 Win=30336 Len=0 TSval=2452262 TSecr=1725506748
16243 1602.535487 ghs.l.google.com -> 192.168.1.100 TCP 66 80→37308 [FIN, ACK] Seq=290 Ack=166 Win=43648 Len=0 TSval=1725506791 TSecr=2452262
16244 1602.535544 192.168.1.100 -> ghs.l.google.com TCP 66 37308→80 [ACK] Seq=166 Ack=291 Win=30336 Len=0 TSval=2452272 TSecr=1725506791

Why would Clementine have to exchange **any data**  at all with Google, when any remote service (including lyrics search) is turned off?
I think there's clearly a privacy issue here.

**Comment by davidsansome** [comment]
This is an IP geocode to get your approximate city-level location.  It's used for the nearby concerts data in the Song Info tab.

There's no personal data sent in the request - the server is doing a geocode based on the client's IP address only.  You can check the source of both the client (https://github.com/clementine-player/Clementine/blob/master/src/internet/core/geolocator.cpp) and the server (https://github.com/clementine-player/Website/blob/master/data.clementine-player.org/clementine.py#L174)

See also previous discussion in https://github.com/clementine-player/Clementine/issues/4898

**Comment by acrobat1** [comment]
I've unchecked literally everything I could spot in the settings as far as this kind of data goes , because I'm not interested in any extra data about the songs, so why should this query  be done *regardless* of such settings?

Geolocation in general (and I mean not only in Clementine) is indeed a privacy concern (as it in general sharing any data not strictly necessary), if web browsers like Firefox allow to turn it off  there is a reason.
I think Clementine should have a way (if not in the GUI, at least "hidden" in its configuration file) to effectively disable such services.

**Comment by ghoust-xxx** [comment]
I'm agree with previous man. Why then I start music player I have to say about it to google? Why I have to say about my geoposition? If I don't use some web-services there is no need to connect to internet at all.

**Comment by matkoniecz** [comment]
> There's no personal data sent in the request - the server is doing a geocode based on the client's IP address only.

I prefer to do not share any data unless strictly necessary. Also, I would not be so quick to consider IP adress as something that is OK to freely share, without option to disable it.

**Comment by matkoniecz** [comment]
Has anybody found workround to block this data leak for Ubuntu?

**Comment by bbbbbr** [comment]
Same, not a fan of this, #4898 and being unable to opt-out (these days it really should be opt-in). The project's response to both issues is disappointing. Just registering another vote on this even though it's closed.

For those on linux you could try something like opensnitch:
https://github.com/evilsocket/opensnitch

**Comment by theokrueger** [comment]
> Has anybody found workround to block this data leak for Ubuntu?

probably the easiest option would be to go to the options and set an invalid proxy so it refuses *any* internet connection

alternatively you could use https://github.com/netblue30/firejail and launch with `firejail --net=none clementine` or previously mentioned sandboxing tools
